date,headline
2026-04-16,Developer tooling startup Expo nabs $45M investment
2026-04-16,"Snap Cuts 1,000 Jobs, Aims to Save $500 Million as AI Reshapes Operations"
2026-04-16,Google Broke Its Promise to Me. Now ICE Has My Data.
2026-04-16,Meta is Raising Quest 3 and Quest 3S Prices Amid Memory Cost Surge
2026-04-16,RAM Crunch Claims Another Victim: Price Hike Coming to Meta Quest VR Headsets
2026-04-16,RAM Crunch Claims Another Victim: Price Hike Coming to Meta Quest VR Headsets
2026-04-16,Samsung may begin making Tesla chips in the US within months
2026-04-16,"Show HN: EDDI – Multi-agent AI engine where agent logic lives in JSON, not code"
2026-04-16,Presentation: From VR to Flat Screens: Bridging the Input and Immersion Gap
2026-04-16,Age verification is a mess but we’re doing it anyway
2026-04-16,meta-ads-mcp-python 1.0.79
2026-04-16,Santosh Khute Launches CodeStory Labs A New-Age Full-Service Digital Agency Built to Transform Brands in the Digital Era
2026-04-16,Alex Cooper’s Unwell Hires Joanne Bradford as President to Lead Expanded Executive Team
2026-04-16,Editorial Note: The residual rate of HPV and the recurrence rate of CIN after LEEP with negative margins: A meta-analysis
2026-04-16,"Molecular characterization of the prevalent soil-transmitted helminths in Narathiwat Province, southern Thailand"
2026-04-16,"Rapid diagnostic tests, laboratory-based immunoassay and nucleic acid testing strategies for long-acting injectable pre-exposure prophylaxis: A systematic review"
2026-04-16,Community-wide deworming strategies to reduce high hookworm burden in endemic communities: Results from a cluster randomized trial in Southern India
2026-04-16,Burden of antimicrobial resistance in culture-confirmed Salmonella Typhi isolates in India from 1977 to 2024: A systematic review and meta-analysis
2026-04-16,Systematic prioritization of potential therapeutic targets for glomerulonephritis using multi-omics Mendelian randomization
2026-04-16,An international consensus on core reproducibility items in research
2026-04-16,Pooled incidence and predictors of infant mortality in low- and middle-income countries using gamma shared frailty model: Insights for achieving the Sustainable Development Goals
2026-04-16,"Beyond silos: Drivers and barriers to intersectoral collaboration in zoonotic disease surveillance and response in the Greater Accra Metropolitan Area, Ghana"
2026-04-16,Correction: A systematic review and meta-analysis of adolescent nutrition in Ethiopia: Transforming adolescent lives through nutrition (TALENT) initiative
2026-04-16,Cost-effectiveness of esketamine versus alternative treatment strategies for treatment-resistant depression in Hong Kong: A multi-armed modeling study
2026-04-16,deepalpha-freqai 1.1.0
2026-04-16,meta-ads-mcp-python added to PyPI
2026-04-16,Pursuing perfect success: the influence of perfectionism on performance and well-being at work
2026-04-16,Meta raises Quest 3 and Quest 3S prices due to RAM shortage | TechCrunch
2026-04-16,Anthropic Plots Major London Expansion
2026-04-16,'The AI Doc' director says ‘F*ck you’ to AI companies stealing artists’ IP
2026-04-16,Push to make US voters love AI gives them new cause to fear it
2026-04-16,Is Bluesky Down Now? Many Users Experiencing Regional Outage as Platform Investigates
2026-04-16,UK PM tells social media bosses to step up child online safety
2026-04-16,Meta Is Increasing The Price Of Quest 3 & Quest 3S
2026-04-16,Nearly 4 in 10 women are missing vaginal bacteria linked to fertility
2026-04-16,Imperial Valley utility could decide fate of massive data center following key vote
2026-04-16,Event organizers in Victoria issue warning as online scammers target vendors
2026-04-16,Box CEO says he looks at a Slack channel to see who is using AI the most — not a token leaderboard
2026-04-16,Akira returns to cinemas – why the legendary anime demands a rewatch
2026-04-16,Health information delivered as a video game can bridge the communication gap between patients and providers
2026-04-16,Apple Glasses Don't Need Cameras. Give Me These 6 Features Instead
2026-04-16,Apple Glasses Don't Need Cameras. Give Me These 6 Features Instead
2026-04-16,"GraniteShares Announces Weekly Distributions for its YieldBOOST ETFs: COYY, TSYY, NVYY, XBTY, AMYY, TQQY, AZYY, YSPY, MTYY, PLYY, HOYY, SMYY, BBYY, FBYY, IOYY, MAAY, NUGY, SEMY, QBY, RGYY, HMYY, RTYY, MUYY, TMYY and CWY"
2026-04-16,This simulation startup wants to be the Cursor for physical AI | TechCrunch
2026-04-16,ome-zarr-models 1.7
2026-04-16,Broadcom to supply Meta with custom silicon through 2029 — Broadom CEO Hock Tan departs Meta's board
2026-04-16,"Ancestry Dot Map, SG-41 Cipher Machine, Silicon Valley, More: Thursday ResearchBuzz, April 16, 2026"
2026-04-16,Reebok Wants a Piece of the Ray-Ban Meta Smart Glasses Action
2026-04-16,Broadcom to supply Meta with custom silicon through 2029 — Broadom CEO Hock Tan departs Meta's board
2026-04-16,Zoomex Launches ZoomexStocks: Trade Global Equities with USDT + Limited-Time Fee Rebate Campaign
2026-04-16,PopSockets MagSafe Smartphone Cases (various styles/designs) Free to Claim + Free S&H
2026-04-16,"Is Rs 70 LPA salary common for Bengaluru techies? Entrepreneur gives a breakdown of real salaries, ‘80% of engineers earn….’"
2026-04-16,"Show HN: Haindy, a CLI that gives coding agents computer use"
2026-04-16,How the American Oligarchy Went Hyperscale
2026-04-16,"Creating Baby Geniuses to Thwart the AI Threat? (Yes, Really.)"
2026-04-16,Geek Tragedy
2026-04-16,Tech Billionaires Want Christians to Believe in AI
2026-04-16,Moody’s CEO: AI has a trust problem – better models won’t fix it
2026-04-16,Number Go Up
2026-04-16,plecost 4.2.3
2026-04-16,"Strong ASML, TSMC forecasts signal AI spending boom is intact"
2026-04-16,WATCH: Starmer Reads Entirely From Notes to Meeting of Seven People
2026-04-16,5 Smart Glasses Tested: Why an $89 Pair Beats Ray-Ban Meta
2026-04-16,Curbing social media to protect kids online could backfire
2026-04-16,"Physical Artificial Intellligence (AI) Research Report 2026: A $3.25 Trillion Market by 2040 from $383 Billion in 2026 with Untapped Potential Across Healthcare, Smart Infrastructure, and Agriculture"
2026-04-16,Starmer’s call to social media companies to keep children safe online: “Take responsibility”
2026-04-16,Now Rolling Out: Facebook’s Opt‑In Camera Roll Suggestions in the EU and UK
2026-04-16,An Interview with F1 Driver and Venture Capitalist Nico Rosberg About the Drive to Win
2026-04-16,Let’s Replace All Corporate Chiefs With AI
2026-04-16,An unexpected source of salt could be causing high blood pressure in millions
2026-04-16,The AI layoff playbook is here
2026-04-16,Data center executives fret over the industry's increasingly toxic public image
2026-04-16,"The Global Carbon Nanomaterials Market 2026-2036: Emerging Applications in Carbon Capture Utilization Signify a Competitive, Evolving Landscape with Significant Growth Potential with China Leading"
2026-04-16,Anthropic unveils plans for major UK expansion after OpenAI announces first permanent London office
2026-04-16,Jane Street commits $6bn to CoreWeave AI cloud partnership
2026-04-16,"Global Market for Computing and AI for Data Centers 2026-2040: AI ASICs is the Fastest-growing Processor Category, As Companies Including Google, Amazon, Microsoft, Meta Invest Heavily"
2026-04-16,Snap's layoffs highlight growing work trend: AI-powered tiny teams
2026-04-16,A Parent’s Guide to the New Instagram and Facebook Safety Changes in Malaysia
2026-04-16,"Deloitte is cutting down PTO, parental leave, and other benefits for some US workers"
2026-04-16,Motorola gets court order to block YouTube videos critical of its phones in India
2026-04-16,Big Tech AI investment 'opportunity' for Ireland
2026-04-16,Forget the chatbot wars. Google DeepMind CEO Demis Hassabis is thinking about something far bigger
2026-04-16,ensemble-mcp added to PyPI
2026-04-16,"Global Wearable Electronics Market Report 2026-2036, Profiles of 700+ Companies, Concentrated at the Top and Richly Diverse in Specialist Niches with Apple, Samsung, Xiaomi, Huawei, and Meta Leading"
2026-04-16,"3 Ways PBS, Planned Parenthood, and Minn. Public News Fight On Amid Budget Cuts"
2026-04-16,"Global Extended Reality (XR) Market 2026-2036: VR, AR, and MR Technologies Analysis and Detailed Profiles of 74 Companies Across the XR Value Chain"
2026-04-16,Show HN: Do Thought Streams Matter? A Benchmark of VLM Reasoning in Gemini 2.5
2026-04-16,deepalpha-freqai 1.0.7
2026-04-16,ubdcc 0.4.1
2026-04-16,‘Beef’ Is Overcrowded and Unfocused in an Unnecessary Season 2: TV Review
2026-04-16,Losing Weight with Fiber-Rich Foods
2026-04-16,Pinterest (PINS): Top 10 Internet Content and Information Stocks to Buy
2026-04-16,Is Meta Platforms a Hot Internet Content and Information Stock as It Invests Heavily in AI?
2026-04-16,TFM Digital Launches That F*cking Marketing Podcast To Cut Through 'Generic Advice'
2026-04-16,"Samsung Raises US Prices on Galaxy Z Flip 7, S25 FE, Tablets, and More"
2026-04-16,Meta-Analysis Links Low Brain Choline Levels to Anxiety Disorders
2026-04-16,TSMC’s Profit Surges 58% On AI-Driven Chip Demand
